{
  "schema_version": 2,
  "title": "THUnion 社团服务",
  "categories": [
    {
      "id": "member-sharing",
      "title": "部员分享",
      "description": "部员分享的整合包、模组下载指引与开源工具。",
      "tools": [
        {
          "id": "thunion-basic-263",
          "title": "三周目快速上服基础包",
          "description": "Minecraft 26.3 · Fabric 0.19.5。下载 263THUnionBasic.mrpack 后可导入启动器；文件从github提供。",
          "url": "https://raw.githubusercontent.com/Pomelene/OnionService4THUnion/main/263THUnionBasic.mrpack",
          "action": "download",
          "filename": "263THUnionBasic.mrpack",
          "size": 1282708,
          "sha256": "bfbe5127ae08a0e83e5c9560819be219043fadb5c183c5c1f6f2479903a140c7",
          "icon": "download",
          "button_text": "下载整合包",
          "badge": "26.3 / Fabric"
        },
        {
          "id": "atlas-offline-guide",
          "title": "Atlas 路径点导航与真人 AFK模组下载指引",
          "description": "打开 Atlas 指引页面，按网站说明下载路径点导航与真人 AFK模组。",
          "url": "https://atlas.thunion.net/guide.html",
          "icon": "world",
          "button_text": "查看下载指引"
        },
        {
          "id": "litematica-flex",
          "title": "Litematica-Flex",
          "description": "柚烯 的 Litematica-Flex 项目，查看项目说明与下载版本。",
          "url": "https://github.com/Pomelene/Litematica-Flex",
          "icon": "world",
          "button_text": "查看项目"
        },
        {
          "id": "pomelene-notebot",
          "title": "Pomelene's Notebot",
          "description": "柚烯 的 Notebot 项目，查看项目说明与下载版本。",
          "url": "https://github.com/Pomelene/Pomelene-s-Notebot",
          "icon": "world",
          "button_text": "查看项目"
        },
        {
          "id": "detransliteration-japanese",
          "title": "DeTransliterationJapanese（日语去音译语言包）",
          "description": "Minecraft 日语去音译语言包：将片假名音译词替换为对应的原语言表记。打开项目页查看语言包文件并下载。",
          "url": "https://github.com/MechtaSnezhevna/DeTransliterationJapanese",
          "action": "web",
          "icon": "world",
          "button_text": "查看语言包",
          "badge": "日语"
        }
      ],
      "layout": "list",
      "icon": "tools",
      "show_urls": false
    },
    {
      "id": "wiki",
      "title": "社团 Wiki",
      "description": "社团文档与知识库入口。",
      "tools": [
        {
          "id": "thunion-wiki",
          "title": "THUnion Wiki",
          "description": "查看社团 Wiki 中的文档、说明与知识条目。点击在启动器内浏览 Wiki 网站。",
          "url": "http://wiki.thunion.club/"
        },
        {
          "id": "thunion-wiki-industrial-guide",
          "title": "三周目工业设施导引",
          "description": "查看三周目工业设施的导引。",
          "url": "http://www.lvss.xyz:14014/index.php?title=%E4%B8%89%E5%91%A8%E7%9B%AE%E5%B7%A5%E4%B8%9A%E8%AE%BE%E6%96%BD%E5%AF%BC%E5%BC%95"
        },
        {
          "id": "thunion-wiki-department-rules",
          "title": "部门规章制度",
          "description": "查看部门规章制度。",
          "url": "http://www.lvss.xyz:14014/index.php?title=%E9%83%A8%E9%97%A8%E8%A7%84%E7%AB%A0%E5%88%B6%E5%BA%A6"
        }
      ],
      "layout": "list",
      "icon": "folder",
      "show_urls": false
    },
    {
      "id": "map",
      "title": "在线地图",
      "description": "选择服务器在线地图；Atlas 另提供路径点导航与真人 AFK模组下载。",
      "tools": [
        {
          "id": "thunion-map",
          "title": "THUnion 在线地图",
          "description": "查看服务器提供的在线地图，内含多维度信息和在线玩家位置统计。",
          "url": "http://map.thunion.club/"
        },
        {
          "id": "thunion-atlas",
          "title": "THUnion Atlas",
          "description": "浏览 Atlas 在线地图；网站同时提供路径点导航与真人 AFK模组下载，可按站内说明获取。",
          "url": "https://atlas.thunion.net/"
        }
      ],
      "layout": "list",
      "icon": "world",
      "show_urls": false
    },
    {
      "id": "official-accounts",
      "title": "社团官号",
      "description": "社团官方账号与内容发布平台。",
      "layout": "list",
      "icon": "world",
      "show_urls": false,
      "tools": [
        {
          "id": "thunion-bilibili",
          "title": "社团哔哩哔哩官号",
          "description": "访问社团哔哩哔哩主页，查看发布的视频与动态。",
          "url": "https://space.bilibili.com/580260285",
          "action": "web",
          "icon": "world",
          "button_text": "访问主页",
          "badge": "哔哩哔哩"
        }
      ]
    }
  ],
  "$schema": "./webapp.schema.json",
  "default_category": "member-sharing"
}
